qid	Title	Tags	query
3	How can I set the Software Center to install software for non root users 	software-center software-installation policykit	How can I set the Software Center to install software for non root users  How can I set the Software Center to allow non root users to install stuff from the Ubuntu repos without having to type in their password I m fully aware of the security implications  and I am willing to take the risk  Fedora 12 shipped with something like this   By modifying the PolicyKit configuration  I believe  software-center software-installation policykit
196614	How do I edit applications panel menu in Lubuntu 	lubuntu menu editing alacarte	How do I edit applications panel menu in Lubuntu  Main menu  alacarte  cannot record changes as it should  Some time it does  but randomly and rarely Is this a bug This question is not a clone of this one  In that case the Main menu would not open  in this case it does but changes are rarely recorded  lubuntu menu editing alacarte
6	How to graphically interface with a headless server 	server ssh security remote-desktop vnc	How to graphically interface with a headless server  I have a ubuntu development server at work  It is an old rack server that is located somewhere in the company s dungeon  where nobody ever goes  The only way it can work is as a so called headless server  i e  with no monitor keyboard connected and only accepting network connections  Obviously  if you just need terminal access ssh is more than enough  I  however  would also like to connect to the graphical interface from time to time  At the moment I am using the built in VNC functionality but I am pretty sure this is neither the most efficient nor the most secure way of approaching this issue I have done a bit of research on the issue but failed to come to any definite conclusions  I read about trying to forward the X environment over ssh  which would at least solve my security concerns  Can anyone share their experiences in setting this up  Is there any other way that might be worth looking at I almost exclusively connect to this server from a Windows machine  I don t know if that might be a problem for some of the methods suggested  server ssh security remote-desktop vnc
7	How do I run a successful Ubuntu Hour 	community locoteams	How do I run a successful Ubuntu Hour  I m taking my be stickered laptop to a coffee shop tonight for an Ubuntu Hour   I ve let a bunch of local LUG people know about it   How can I ensure people come away from it feeling like the experience was valuable   Is there something you ve done that was particularly successful There is a wiki page about Ubuntu Hours which is very helpful   I m interested in collecting best practices from the community  community locoteams
9	How do I enable automatic updates 	updates unattended-upgrades	How do I enable automatic updates  Update Manager is constantly offering me updates  e g  security fixes  updates from PPAs  How can I tell my Ubuntu installation to automatically download and install updates whenever they become available  updates unattended-upgrades
262154	Trim and SSD with USB 3 0 enclosure does not work   UASP not supported 	usb ssd trim	Trim and SSD with USB 3 0 enclosure does not work   UASP not supported  I have installed one SSD disk  Micron C400 MTFDDAC128MAM  in an external USB 3 0 enclosure  Now I want use this disk as a second disk in my laptop with Ubuntu 12 04  The disk is working  but I want to use TRIM support which is not working as expected Checking for TRIM support user server    sudo hdparm  I  dev sdc   grep  i TRIM            Data Set Management TRIM supported  limit 8 blocks             Deterministic read data after TRIMDisk was mounted with the following options  dev sdc1 on  media MICRON type ext4  rw nosuid nodev uhelper udisks But when I run the TRIM command manually  I get an error user server    sudo fstrim  v  media MICRON fstrim   media MICRON   FITRIM ioctl failed  Operation not permittedI used this disk before as an internal disk and TRIM was working Here are some USB details   1039 248050  usb 4 1  new SuperSpeed USB device number 4 using xhci hcd  1039 265597  scsi8   usb storage 4 1 1 0  1041 547879  scsi 8 0 0 0  Direct Access     C400 MTF DDAC128MAM       0509 PQ  0 ANSI  5  1041 549134  sd 8 0 0 0  Attached scsi generic sg2 type 0  1041 550511  sd 8 0 0 0   sdc  250069680 512 byte logical blocks   128 GB 119 GiB   1041 550778  sd 8 0 0 0   sdc  Write Protect is off  1041 550785  sd 8 0 0 0   sdc  Mode Sense  23 00 00 00  1041 552520  sd 8 0 0 0   sdc  No Caching mode page present  1041 552528  sd 8 0 0 0   sdc  Assuming drive cache  write through  1041 554029  sd 8 0 0 0   sdc  No Caching mode page present  1041 554035  sd 8 0 0 0   sdc  Assuming drive cache  write through  1041 678373   sdc  sdc1  1041 679982  sd 8 0 0 0   sdc  No Caching mode page present  1041 679991  sd 8 0 0 0   sdc  Assuming drive cache  write through  1041 679997  sd 8 0 0 0   sdc  Attached SCSI diskHow to find out if the mass storage device uses the UASP  USB Attached SCSI Protocol  which should support TRIM  usb ssd trim
11	How do I install Adobe Flash player 	flash software-installation	How do I install Adobe Flash player  I have had significant problems with watching flash video in 64 bit Ubuntu   Does anyone know of a good way to get flash running on the platform  flash software-installation
65549	var cache apt archives occupying huge space	cleanup apt-cache	var cache apt archives occupying huge space I am in the process of cleaning up my system  And I see a lot of space occupied by this folder  var cache apt archives  1 5GB   Is it absolutely necessary to keep all these archives  cleanup apt-cache
98319	correct Installation and configuration of openJDK and R	java openjdk r	correct Installation and configuration of openJDK and R I am relatively new to Ubuntu so I wont know a lot of commands that probably became standard to a lot of you guys I am trying to set up R and with it the necessary java dependencies to install e g  JGR  rjava  etc  I read through quite a few instructions to do that but somehow I must have done sth wrong  Here is the state of R and java R   versionR version 2 14 1  2011 12 22 Copyright  C  2011 The R Foundation for Statistical ComputingISBN 3 900051 07 0Platform  x86 64 pc linux gnu  64 bit java  versionjava version  1 6 0 23 OpenJDK Runtime Environment  IcedTea6 1 11pre   6b23 pre11 0ubuntu1 11 10 1 OpenJDK 64 Bit Server VM  build 20 0 b11  mixed mode R CMD javareconfJava interpreter    usr bin javaJava version       1 6 0 23Java home path      usr lib jvm java 6 openjdk jreJava compiler       usr bin javacJava headers gen    usr bin javahJava archive tool   usr bin jarJava library path   usr lib jvm java 6 openjdk jre lib amd64 server  usr lib jvm java 6 openjdk jre lib amd64  usr lib jvm java 6 openjdk jre    lib amd64  usr java packages lib amd64  usr lib jni  lib  usr libJNI linker flags    L usr lib jvm java 6 openjdk jre lib amd64 server  L usr lib jvm java 6 openjdk jre lib amd64  L usr lib jvm java 6 openjdk jre    lib amd64  L usr java packages lib amd64  L usr lib jni  L lib  L usr lib  ljvmJNI cpp flags      But when I try to install  JavaGD  in R  which is a dependency for JGR I get    checking Java support in R    present interpreter     usr bin java cpp flags       java libs       L usr lib jvm java 6 openjdk jre lib amd64 server  L usr lib jvm java 6 openjdk jre lib amd64  L usr lib jvm java 6 openjdk jre    lib amd64  L usr java packages lib amd64  L usr lib jni  L lib  L usr lib  ljvm configure  error  One or more Java configuration variables are not set Make sure R is configured with full Java support  including JDK   RunR CMD javareconfas root to add Java support to R    Any help would be greatly appreciated  Thanks  java openjdk r
360466	How do I sync contacts on Ubuntu Touch 	ubuntu-touch sync contacts	How do I sync contacts on Ubuntu Touch  How do I sync  upload to download from  my contacts  with my Ubuntu Touch OS  ubuntu-touch sync contacts
360478	Don t have network connection using a BCM4313 adapter	wireless broadcom	Don t have network connection using a BCM4313 adapter I just upgraded to Ubuntu 13 10  but since the upgrade I don t have internet access via wifi anymore I can See networksConnect to a networkPing myself  localhost  192 168 0 103 I can t Ping others  including other devices on the same wireless network  including the gateway router Resolve hostsAccess any other external resource  whether on my own network or on the internetUsing Wireshark  I noticed my computer is continuously sending ARP requests like  Who has 192 168 0 1  which is the gateway   Tell 192 168 0 103   It doesn t get any replies though  When I ping another IP address for which it knows the mac address  from cache   it turns out a packet loss of  90  occurs  and even if a packet manages to arrive it takes around 3000ms The output of route  n is Kernel IP routing tableDestination     Gateway         Genmask         Flags Metric Ref    Use Iface0 0 0 0         192 168 0 1     0 0 0 0         UG    0      0        0 eth1192 168 0 0     0 0 0 0         255 255 255 0   U     9      0        0 eth1192 168 122 0   0 0 0 0         255 255 255 0   U     0      0        0 virbr0Before upgrading  wifi worked fine  Using other devices  wifi still works fine Resetting the router didn t help  Ethernet still works after upgrading Any suggestions Update  I m using the wl driver  Here s the relevant output of some commands lspci   grep Wireless03 00 0 Network controller  Broadcom Corporation BCM4313 802 11bgn Wireless Network Adapter  rev 01 cat  etc modprobe d blacklist conf     blacklist mac80211blacklist brcm80211blacklist cfg80211blacklist lib80211 crypt tkipblacklist lib80211blacklist b43cat  etc rc localsudo modprobe  r lib80211sudo insmod  lib modules 3 2 0 30 generic pae kernel net wireless lib80211 kosudo insmod  lib modules 3 2 0 30 generic pae kernel net wireless lib80211 crypt wep kosudo insmod  lib modules 3 2 0 30 generic pae kernel net wireless lib80211 crypt tkip kosudo insmod  lib modules 3 2 0 30 generic pae kernel net wireless lib80211 crypt ccmp kosudo modprobe wlexit 0The last lines are probably how I got wireless working after the previous upgrade  wireless has been a problem after each upgrade  Update 2  added information about the exact hardware below The hardware is an integrated device  so I ran lspci  nn   grep  i network  The output is 03 00 0 Network controller  0280   Broadcom Corporation BCM4313 802 11bgn Wireless Network Adapter  14e4 4727   rev 01  wireless broadcom
32800	How can I disable modify the SSH login banner for a given user 	command-line ssh	How can I disable modify the SSH login banner for a given user  How can I disable modify the SSH login banner for a given user  command-line ssh
34	What s the easiest way to set up a LAMP stack 	software-installation lamp	What s the easiest way to set up a LAMP stack  I set up a new VPS instance of Ubuntu and am wondering what the easiest way is to get up and running with a basic LAMP stack  i e  which packages are required  which configuration options need to be tweaked  if any  etc    software-installation lamp
36	What is the performance loss if you run Ubuntu desktop edition on a server machine 	server performance	What is the performance loss if you run Ubuntu desktop edition on a server machine  We have installed Ubuntu desktop edition on our dev server I was wondering if there is any noticeable performance loss compared to the server edition  server performance
37	When installing I m given the option of encrypting my home folder    what does this do 	system-installation encryption ecryptfs	When installing I m given the option of encrypting my home folder    what does this do  Does encrypting my home folder make my computer more secure Do I have to enter my password more if my home folder is encrypted What else should I know about encrypting my home folder  system-installation encryption ecryptfs
1245227	How to add the APT key for Microsoft packages	apt keyrings microsoft	How to add the APT key for Microsoft packages I m trying to install some packages from the Microsoft APT Repository  because I hate Snap with a passion   but I can t seem to be able to add its key   curl https   packages microsoft com keys microsoft asc   sudo apt key add  OKIt says OK  but the key doesn t work   sudo apt update     Err 7 https   packages microsoft com repos vscode stable InRelease  The following signatures couldn t be verified because the public key is not available  NO PUBKEY EB3E94ADBE1229CFReading package lists    DoneW  GPG error  https   packages microsoft com repos vscode stable InRelease  The following signatures couldn t be verified because the public key is not available  NO PUBKEY EB3E94ADBE1229CFE  The repository  https   packages microsoft com repos vscode stable InRelease  is not signed N  Updating from such a repository can t be done securely  and is therefore disabled by default N  See apt secure 8  manpage for repository creation and user configuration details I also tried retrieving the key starting from the NO PUBKEY id printed by apt get   sudo apt key adv   keyserver hkp   keyserver ubuntu com 80   recv EB3E94ADBE1229CFExecuting   tmp apt key gpghome q9IjlmqKv9 gpg 1 sh   keyserver hkp   keyserver ubuntu com 80   recv EB3E94ADBE1229CFgpg  key EB3E94ADBE1229CF   Microsoft  Release signing    not changedgpg  Total number processed  1gpg               unchanged  1It says  not changed  and in fact  nothing changes If I check the output of apt key list I see that all third party keys have a sub rsa4096 except Microsoft s  Is this why it doesn t work   sudo apt key list  etc apt trusted gpg                    pub   rsa4096 2017 05 08  SCEA       1EDD E2CD FC02 5D17 F6DA  9EC0 ADAE 6AD2 8A8F 901Auid             unknown  Sublime HQ Pty Ltd sub   rsa4096 2017 05 08  S pub   rsa4096 2016 04 12  SC       EB4C 1BFD 4F04 2F6D DDCC  EC91 7721 F63B D38B 4796uid             unknown  Google Inc   Linux Packages Signing Authority  sub   rsa4096 2019 07 22  S   expires  2022 07 21 pub   rsa4096 2014 06 13  SC       9FD3 B784 BC1C 6FC3 1A8A  0A1C 1655 A0AB 6857 6280uid             unknown  NodeSource sub   rsa4096 2014 06 13  E pub   rsa2048 2015 10 28  SC       BC52 8686 B50D 79E3 39D3  721C EB3E 94AD BE12 29CFuid             unknown  Microsoft  Release signing       How do I solve this issue Ubuntu 20 04 focal apt keyrings microsoft
32812	Need some help creating a script to rename text files and move them to a directory	bash files scripts	Need some help creating a script to rename text files and move them to a directory I have recently managed to convince my mother to let me switch her PC to Ubuntu  and to make her transition easier I want to automate as many tasks as possible for her  I managed to do quite a bit  however there is a script I d like to leave her with  but  unfortunately I have no knowledge of scripting The purpose would be to rename all text files in a folder  mainly Desktop  named e g   note    w out extension  as  note txt   for interoperability s sake and easy upload to google docs  and move them in a specially designated folder  The commands I d need would be   find files in current folder named note   and not ending in  txt  and rename them as note  txt  move files named note  txt to  home username notesUnfortunately I don t know how to put it in script form so I m asking for help  bash files scripts
163903	Gaming performance difference between Windows and Ubuntu	windows wine games performance playonlinux	Gaming performance difference between Windows and Ubuntu What are the pros cons switching from Windows 7 8 to Ubuntu I mainly develop software and play games I obviously don t play games on my laptop that s why I give Ubuntu a try  But the whole OS looks great and I recently discovered PlayOnLinux How big is the performance hit from Windows games  What if the game supports DX11 and has tessellation  does PlayOnLinux translate DX11 to OpenGL  windows wine games performance playonlinux
66	Upgrade experiences from 8 04 LTS to 10 04 LTS 	10.04 upgrade 8.04	Upgrade experiences from 8 04 LTS to 10 04 LTS  I am running 8 04 desktop as a server and hosting my own web server  has anyone experienced any issues with upgrade from 8 04 to 10 04  10.04 upgrade 8.04
67	How do I enable full color support in Vim 	command-line vim colors	How do I enable full color support in Vim  I have a lovely Vim colorscheme  xoria256  and it looks brilliant in GVim  but when I use normal vim in Terminal  the colorscheme is only partially supported    for example  the default semi transparent aubergine background color is used  How do I make Terminal faithfully render my Vim colorscheme  command-line vim colors
69	Keeping multiple workstations in sync	sync configuration user-data multiple-workstations	Keeping multiple workstations in sync I work with multiple computers for various reasons  I want to keep those computers in sync configuration wise  I already have a VCS based setup that allows me to manually update configurations on multiple hosts  But i m looking for a way to do this automatically What I m looking for is A way to sync configuration  vim  ssh  evolution keeping certain directories in sync  like   Documents This is all user configuration and not system configuration  At times the workstation can be offline or behind a slow link  so being able to detect that and act accordingly is a plus  sync configuration user-data multiple-workstations
393289	How to install libdb4 8   dev or equivalent on 13 10 	installation 13.10 package-management	How to install libdb4 8   dev or equivalent on 13 10  I am trying to test a mod that I ve created of Peercoin I need to install libdb4 8   dev  but it is not available How can I install it or an equivalent Note  this is not a dupe since I cannot install a package of my custom alteration of Peercoin  installation 13.10 package-management
131149	Where else to go for help if not helped at Ask Ubuntu 	community	Where else to go for help if not helped at Ask Ubuntu  What other official places can I go for getting help on Ubuntu if I do not get the help I wanted on Ask Ubuntu  community
