qid	Title	Tags	query
1409105	Ubuntu 22 04 SSH the RSA key isn t working since upgrading from 20 04	ssh encryption rsync	Ubuntu 22 04 SSH the RSA key isn t working since upgrading from 20 04 Up until last week I was running Ubuntu 20 04 happily  and then over the weekend decided to back everything up and install 22 04   I ve had a couple of teething issues which I ve solver  however I m having real issues with SSH   I have two first generation WD MyCloud drives which handle all my backups and files both on and away from home   I can still connect to the shares with no problems  however I need to SSH onto both drives in order to run maintenance  backup between cloud drives  etc Initially I couldn t gain SSH access at all after upgrading  however the one fix at this website worked   I can now connect via SSH and entering a password However with Ubuntu 20 04 I had set up a passphrase so that various autyomated scripts that I use using rsync could copy between cloud drives and also between Ubuntu and the cloud drive shares   This was working until I upgraded  now the scripts continually ask me for my password and I can t figure out how to stop it What I was originally doing was runningssh keygen  b 4096to generate a passphrase and thenssh copy id root serverto copy the passphrase acrossIf I then enteredssh root serverit simply connected without asking to my password I know this is going to be due to my cloud drives only supporting the now insecure SSH  but I cannot upgrade it to a more secure one  unless someone knows how   I would prefer to do this to be honest    My maintenance scripts can make up to 20 connections over a period of hours  and to have to sit and constantly enter the password is becoming a pain Can anyone help me get my remote rsync commands working again so they don t keep asking me for my passwordThe terminal outputs as I run through these arecolin colin desktop    ssh  ssh keygen  b 4096Generating public private rsa key pair Enter file in which to save the key   home colin  ssh id rsa   Enter passphrase  empty for no passphrase   Enter same passphrase again  Your identification has been saved in  home colin  ssh id rsaYour public key has been saved in  home colin  ssh id rsa pubThe key fingerprint is SHA256 xxxxxxxxxxxxxxxxxxxxxxxxxxxxxxxxxxxxxxxxxxx colin colin desktopThe key s randomart image is      RSA 4096               SHA256       colin colin desktop    ssh  ssh copy id root xxx xxx xxx xxx usr bin ssh copy id  INFO  attempting to log in with the new key s   to filter out any that are already installed usr bin ssh copy id  INFO  1 key s  remain to be installed    if you are prompted now it is to install the new keysroot xxx xxx xxx xxx s password  Number of key s  added  1Now try logging into the machine  with     ssh  root xxx xxx xxx xxx  and check to make sure that only the key s  you wanted were added colin colin desktop    ssh  ssh root xxx xxx xxx xxxroot xxx xxx xxx xxx s password  Linux NASServer 3 2 26  1 SMP Thu Jul 9 11 14 15 PDT 2015 wd 2 4 rel armv7lThe programs included with the Debian GNU Linux system are free software the exact distribution terms for each program are described in theindividual files in  usr share doc   copyright Debian GNU Linux comes with ABSOLUTELY NO WARRANTY  to the extentpermitted by applicable law NASServer    cd    sshNASSERVER    ssh  ls  altotal 12drwx       2 root root 4096 May 17 23 32  drwx       7 root root 4096 Apr 28 19 02    rw        1 root root  742 May 17 23 32 authorized keysNASServer    ssh  exitlogoutConnection to xxx xxx xxx xxx closed colin colin desktop    rsync   verbose   archive  e  ssh  p 22    Files  root xxx xxx xxx xxx  shares Files root xxx xxx xxx xxx s password  How this originally came about was that I needed to be able to rsync to and from a remote location without the need for a human intervention regarding security  The instructions I was given were to use ssh keygen to generate public private keys and then ssh copy id to copy the public key to the remote host   I ve just reinstalled 20 04 on another machine and used this successfully and the rsync is working without the need for a password   However if I clear the keys on the server out  reinstall 22 04 and do the same  it still prompts me for the password   I ve updated my question to show the output of the commands as they are being run on Ubuntu 22 04 with the server name obscured for obvious reasons The Terminal output of rsync  vvv followscolin colin desktop    ssh  vvv root xxx xxx xxx xxxOpenSSH 8 9p1 Ubuntu 3  OpenSSL 3 0 2 15 Mar 2022debug1  Reading configuration data  home colin  ssh configdebug3  kex names ok   diffie hellman group1 sha1 diffie hellman group14 sha1 diffie hellman group14 sha256 diffie hellman group16 sha512 diffie hellman group18 sha512 diffie hellman group exchange sha1 diffie hellman group exchange sha256 ecdh sha2 nistp256 ecdh sha2 nistp384 ecdh sha2 nistp521 curve25519 sha256 curve25519 sha256 libssh org sntrup761x25519 sha512 openssh com debug1  Reading configuration data  etc ssh ssh configdebug1   etc ssh ssh config line 19  include  etc ssh ssh config d   conf matched no filesdebug1   etc ssh ssh config line 21  Applying options for  debug2  resolve canonicalize  hostname xxx xxx xxx xxx is addressdebug3  expanded UserKnownHostsFile     ssh known hosts       home colin  ssh known hosts debug3  expanded UserKnownHostsFile     ssh known hosts2       home colin  ssh known hosts2 debug3  ssh connect direct  enteringdebug1  Connecting to xxx xxx xxx xxx  xxx xxx xxx xxx  port 22 debug3  set sock tos  set socket 3 IP TOS 0x10debug1  Connection established debug1  identity file  home colin  ssh id rsa type 0debug1  identity file  home colin  ssh id rsa cert type  1debug1  identity file  home colin  ssh id ecdsa type  1debug1  identity file  home colin  ssh id ecdsa cert type  1debug1  identity file  home colin  ssh id ecdsa sk type  1debug1  identity file  home colin  ssh id ecdsa sk cert type  1debug1  identity file  home colin  ssh id ed25519 type  1debug1  identity file  home colin  ssh id ed25519 cert type  1debug1  identity file  home colin  ssh id ed25519 sk type  1debug1  identity file  home colin  ssh id ed25519 sk cert type  1debug1  identity file  home colin  ssh id xmss type  1debug1  identity file  home colin  ssh id xmss cert type  1debug1  identity file  home colin  ssh id dsa type  1debug1  identity file  home colin  ssh id dsa cert type  1debug1  Local version string SSH 2 0 OpenSSH 8 9p1 Ubuntu 3debug1  Remote protocol version 2 0  remote software version OpenSSH 6 0p1 Debian 4debug1  compat banner  match  OpenSSH 6 0p1 Debian 4 pat OpenSSH  compat 0x04000000debug2  fd 3 setting O NONBLOCKdebug1  Authenticating to xxx xxx xxx xxx 22 as  root debug3  send packet  type 20debug1  SSH2 MSG KEXINIT sentdebug3  receive packet  type 20debug1  SSH2 MSG KEXINIT receiveddebug2  local client KEXINIT proposaldebug2  KEX algorithms  diffie hellman group1 sha1 diffie hellman group14 sha1 diffie hellman group14 sha256 diffie hellman group16 sha512 diffie hellman group18 sha512 diffie hellman group exchange sha1 diffie hellman group exchange sha256 ecdh sha2 nistp256 ecdh sha2 nistp384 ecdh sha2 nistp521 curve25519 sha256 curve25519 sha256 libssh org sntrup761x25519 sha512 openssh com ext info cdebug2  host key algorithms  ssh ed25519 ssh ed25519 cert v01 openssh com sk ssh ed25519 openssh com sk ssh ed25519 cert v01 openssh com ssh rsa ssh dss ecdsa sha2 nistp256 ecdsa sha2 nistp384 ecdsa sha2 nistp521 sk ecdsa sha2 nistp256 openssh com ssh rsa cert v01 openssh com ssh dss cert v01 openssh com ecdsa sha2 nistp256 cert v01 openssh com ecdsa sha2 nistp384 cert v01 openssh com ecdsa sha2 nistp521 cert v01 openssh com sk ecdsa sha2 nistp256 cert v01 openssh comdebug2  ciphers ctos  3des cbc aes128 cbc aes192 cbc aes256 cbc aes128 ctr aes192 ctr aes256 ctr aes128 gcm openssh com aes256 gcm openssh com chacha20 poly1305 openssh comdebug2  ciphers stoc  3des cbc aes128 cbc aes192 cbc aes256 cbc aes128 ctr aes192 ctr aes256 ctr aes128 gcm openssh com aes256 gcm openssh com chacha20 poly1305 openssh comdebug2  MACs ctos  hmac sha1 hmac sha1 96 hmac sha2 256 hmac sha2 512 hmac md5 hmac md5 96 umac 64 openssh com umac 128 openssh com hmac sha1 etm openssh com hmac sha1 96 etm openssh com hmac sha2 256 etm openssh com hmac sha2 512 etm openssh com hmac md5 etm openssh com hmac md5 96 etm openssh com umac 64 etm openssh com umac 128 etm openssh comdebug2  MACs stoc  hmac sha1 hmac sha1 96 hmac sha2 256 hmac sha2 512 hmac md5 hmac md5 96 umac 64 openssh com umac 128 openssh com hmac sha1 etm openssh com hmac sha1 96 etm openssh com hmac sha2 256 etm openssh com hmac sha2 512 etm openssh com hmac md5 etm openssh com hmac md5 96 etm openssh com umac 64 etm openssh com umac 128 etm openssh comdebug2  compression ctos  none zlib openssh com zlibdebug2  compression stoc  none zlib openssh com zlibdebug2  languages ctos  debug2  languages stoc  debug2  first kex follows 0 debug2  reserved 0 debug2  peer server KEXINIT proposaldebug2  KEX algorithms  ecdh sha2 nistp256 ecdh sha2 nistp384 ecdh sha2 nistp521 diffie hellman group exchange sha256 diffie hellman group exchange sha1 diffie hellman group14 sha1 diffie hellman group1 sha1debug2  host key algorithms  ssh rsa ssh dssdebug2  ciphers ctos  aes128 ctr aes192 ctr aes256 ctr arcfour256 arcfour128 aes128 cbc 3des cbc blowfish cbc cast128 cbc aes192 cbc aes256 cbc arcfour rijndael cbc lysator liu sedebug2  ciphers stoc  aes128 ctr aes192 ctr aes256 ctr arcfour256 arcfour128 aes128 cbc 3des cbc blowfish cbc cast128 cbc aes192 cbc aes256 cbc arcfour rijndael cbc lysator liu sedebug2  MACs ctos  hmac md5 hmac sha1 umac 64 openssh com hmac sha2 256 hmac sha2 256 96 hmac sha2 512 hmac sha2 512 96 hmac ripemd160 hmac ripemd160 openssh com hmac sha1 96 hmac md5 96debug2  MACs stoc  hmac md5 hmac sha1 umac 64 openssh com hmac sha2 256 hmac sha2 256 96 hmac sha2 512 hmac sha2 512 96 hmac ripemd160 hmac ripemd160 openssh com hmac sha1 96 hmac md5 96debug2  compression ctos  none zlib openssh comdebug2  compression stoc  none zlib openssh comdebug2  languages ctos  debug2  languages stoc  debug2  first kex follows 0 debug2  reserved 0 debug1  kex  algorithm  diffie hellman group1 sha1debug1  kex  host key algorithm  ssh rsadebug1  kex  server  client cipher  3des cbc MAC  hmac sha1 compression  nonedebug1  kex  client  server cipher  3des cbc MAC  hmac sha1 compression  nonedebug2  bits set  515 1024debug3  send packet  type 30debug1  expecting SSH2 MSG KEX ECDH REPLYdebug3  receive packet  type 31debug1  SSH2 MSG KEX ECDH REPLY receiveddebug1  Server host key  ssh rsa SHA256 XXXXXXXXXXXXXXXXXXXXXXXXXXXXXXXXXXXXXXXXXXXdebug3  record hostkey  found key type RSA in file  home colin  ssh known hosts 1debug3  load hostkeys file  loaded 1 keys from xxx xxx xxx xxxdebug1  load hostkeys  fopen  home colin  ssh known hosts2  No such file or directorydebug1  load hostkeys  fopen  etc ssh ssh known hosts  No such file or directorydebug1  load hostkeys  fopen  etc ssh ssh known hosts2  No such file or directorydebug1  Host  xxx xxx xxx xxx  is known and matches the RSA host key debug1  Found key in  home colin  ssh known hosts 1debug2  bits set  495 1024debug3  send packet  type 21debug2  ssh set newkeys  mode 1debug1  rekey out after 134217728 blocksdebug1  SSH2 MSG NEWKEYS sentdebug1  expecting SSH2 MSG NEWKEYSdebug3  receive packet  type 21debug1  SSH2 MSG NEWKEYS receiveddebug2  ssh set newkeys  mode 0debug1  rekey in after 134217728 blocksdebug1  get agent identities  bound agent to hostkeydebug1  get agent identities  agent returned 1 keysdebug1  Will attempt key   home colin  ssh id rsa RSA SHA256 XXXXXXXXXXXXXXXXXXXXXXXXXXXXXXXXXXXXXXXXXXX agentdebug1  Will attempt key   home colin  ssh id ecdsa debug1  Will attempt key   home colin  ssh id ecdsa sk debug1  Will attempt key   home colin  ssh id ed25519 debug1  Will attempt key   home colin  ssh id ed25519 sk debug1  Will attempt key   home colin  ssh id xmss debug1  Will attempt key   home colin  ssh id dsa debug2  pubkey prepare  donedebug3  send packet  type 5debug3  receive packet  type 6debug2  service accept  ssh userauthdebug1  SSH2 MSG SERVICE ACCEPT receiveddebug3  send packet  type 50debug3  receive packet  type 51debug1  Authentications that can continue  publickey passworddebug3  start over  passed a different list publickey passworddebug3  preferred gssapi with mic publickey keyboard interactive passworddebug3  authmethod lookup publickeydebug3  remaining preferred  keyboard interactive passworddebug3  authmethod is enabled publickeydebug1  Next authentication method  publickeydebug1  Offering public key   home colin  ssh id rsa RSA SHA256 XXXXXXXXXXXXXXXXXXXXXXXXXXXXXXXXXXXXXXXXXXX agentdebug1  send pubkey test  no mutual signature algorithmdebug1  Trying private key   home colin  ssh id ecdsadebug3  no such identity   home colin  ssh id ecdsa  No such file or directorydebug1  Trying private key   home colin  ssh id ecdsa skdebug3  no such identity   home colin  ssh id ecdsa sk  No such file or directorydebug1  Trying private key   home colin  ssh id ed25519debug3  no such identity   home colin  ssh id ed25519  No such file or directorydebug1  Trying private key   home colin  ssh id ed25519 skdebug3  no such identity   home colin  ssh id ed25519 sk  No such file or directorydebug1  Trying private key   home colin  ssh id xmssdebug3  no such identity   home colin  ssh id xmss  No such file or directorydebug1  Trying private key   home colin  ssh id dsadebug3  no such identity   home colin  ssh id dsa  No such file or directorydebug2  we did not send a packet  disable methoddebug3  authmethod lookup passworddebug3  remaining preferred   passworddebug3  authmethod is enabled passworddebug1  Next authentication method  passwordroot xxx xxx xxx xxx s password   ssh encryption rsync
98393	How do I get 2560x1440 resolution within VirtualBox on a Mac 	virtualbox mac	How do I get 2560x1440 resolution within VirtualBox on a Mac  I m trying to get a functional Ubuntu instance running in VirtualBox on my iMac 27    The iMac has a resolution of 2560x1440  and I d like to run Ubuntu in full screen at that resolution I ve installed the Guest Additions that come with VirtualBox  rather than the ones in the archive    I m using Ubuntu 11 10 64 bit   The display currently runs at 1600x1200  and when I run the displays dialog  or xrandr   I get a list of resolutions that are 1600x1200 or smaller  and are all at 4 3 aspect ratio  whereas the iMac monitor is 16 9  The settings for the virtual machine have video memory set to 128MB   Whether I run the VM with or without 3D acceleration makes no difference to the available resolutions  although with 3D acceleration enabled  launched windows aren t visible – a different question perhaps  I have a natty VirtualBox VM that does run at 2560x1440  so I know it s possible   However  I don t know how to achieve it Thanks jml virtualbox mac
131168	How do I uninstall GRUB 	grub2 uninstall	How do I uninstall GRUB  A hard drive that I use only for data storage still has GRUB from past Ubuntu installations How can I remove GRUB from it without harming the rest of the drive s data BackgroundI occasionally move the data drive between computers with various boot order configurations  so I would like it to be non bootable in order to avoid having to accommodate it in each computer s BIOS settings When I power on a computer while only the data drive is attached  the following appears error  no such device  fdf38dd4 9e9d 479d b830 2a6989958503 grub rescue  I can confirm from old backups of  etc fstab that this was the UUID of a root partition that I recently reformatted and which no longer exists  Here s the the data drive s partition table and raw master boot record Please note that I m not interested in workarounds that don t answer my primary question  I can think of several ways to work around this issue  but it bothers me on principle that I don t know how to directly resolve it  Every installation procedure should have a counterpart uninstallation procedure  grub2 uninstall
108	How can I best retest a bug in a newer or development release 	launchpad bug-reporting	How can I best retest a bug in a newer or development release  I have reported a bug that occurs in Karmic on launchpad  and I have been asked to re test it on lucid or maverick  How can I do this best   launchpad bug-reporting
491629	How to install PHP  mbstring  extension in Ubuntu 	14.04 php extension	How to install PHP  mbstring  extension in Ubuntu  What is the  PHP mbstring extension  and what is the best way to install it on Ubuntu 14 04  14.04 php extension
65645	How can I enable Chrome Chromium Unity integration 	unity google-chrome chromium	How can I enable Chrome Chromium Unity integration  I installed Ubuntu yesterday on a new laptop  After downloading and installing Chrome  I realized that there is no experimental integration Gnome3 Unity flag in about flags  I remember using the integration with Chrome on an older machine  is it by some mistake that I can t see it here or was it remove from the experimental features of Chrome I can still see double close minimize maximize buttons   one set from the window manager  the other from chrome  unity google-chrome chromium
111	GUI for iptables 	gui iptables security	GUI for iptables  I would like to secure my server and it seems that IPtables is one of the first steps  Unfortunately editing the rules in a terminal is a bit complicated and dangerous  those who ever did an iptables  F will know what I mean       Could you recommend any good graphical interfaces for managing my IPtables rules  gui iptables security
98416	Error  kernel headers not found   But they are in place 	kernel virtualbox	Error  kernel headers not found   But they are in place  I m trying to install the Guest Additions in VirtualBox 4 04  Host OS is Ubuntu desktop 11 04 64bit  guest OS is Ubuntu server 11 10 64bit   sudo   VBoxLinuxAdditions runAfter some output this line is printed The headers for the current running kernel were not found But the headers are installed  at least accordingly to dpkg   dpkg   get selections   grep linux headerslinux headers 3 0 0 12            installlinux headers 3 0 0 12 server     installlinux headers server              installThe running kernel is   uname  aLinux foobar 3 0 0 12 server  20 Ubuntu SMP Fri Oct 7 16 36 30 UTC 2011 x86 64 x86 64 X86 64 GNU LinuxHow do I fix things so that Guest Additions installer is able to find kernel headers Update  added full output The headers for the current running kernel were not found  If the module compilation fails then this could be the reason Building the main Guest Additions module    done Building the shared folder support module    fail  Look at  var log vboxadd install log to find out what went wrong Installing the Window System drivers    fails  Could not find the X Org or XFree86 Window System  I don t care for fail  2  because that s a server and I don t need X server  But I need shared folder support Some further detail   tail  val log vboxadd install log          cc1  some warnings being treated as errorsmake 2         tmp vbox 0 vfsmod o  Error 1make 1         module  tmp vbox 0  Error 2make       vboxsf  Error 2 kernel virtualbox
163962	 Install alongside  option missing  How do I install Ubuntu beside Windows using  Something Else  	windows-7 system-installation ubiquity	 Install alongside  option missing  How do I install Ubuntu beside Windows using  Something Else   Whenever I startup from the LinuxLive USB  and try to install Ubuntu 12 04  it only gives me two options instead of the usual 3 or 4  My options are  Replace Windows 7 with Ubuntu  and  Something Else   Whenever I go into  Something else   it looks extremely confusing  How do I install it side by side while using the  Something else  section  These are my partitions   dev sda dev sda1 ntfs  104Mb  System Required Partition  dev sda2 ntfs  1000097Mb  Windows 7 Partition Or should I try reinstalling my installer on a CD rather than USB and maybe then it will have the  Install alongside  function  windows-7 system-installation ubiquity
327807	Any 3D CAD programs for Ubuntu 	software-recommendation 3d cad	Any 3D CAD programs for Ubuntu  I need a good CAD program for mechanical engineering Are there any good 3D CAD programs available for Ubuntu like Autocad    software-recommendation 3d cad
127	How do I get involved with testing and QA with Ubuntu 	automation testing quality	How do I get involved with testing and QA with Ubuntu  I d like to get involved with Ubuntu QA by creating automated tests  Is there an ongoing effort to create these tests  Where can I learn more  automation testing quality
131	Where can I find a list of computers guaranteed to work with Ubuntu 	hardware compatibility hardware-certification	Where can I find a list of computers guaranteed to work with Ubuntu  Before I buy my next laptop  I d like to make sure that it will work perfectly with Ubuntu  Is there a list of completely supported computers anywhere  hardware compatibility hardware-certification
134	How do I create a desktop wallpaper slideshow 	desktop-background appearance	How do I create a desktop wallpaper slideshow  How do  I create a desktop wallpaper slideshow with my own set of images With the images coming from a pictures folder  or pre selectedWith the images displayed in order  or randomlyWith the images changing every few minutes  or after random periods of time desktop-background appearance
655496	How to edit multiple text files with a single command 	command-line text-processing	How to edit multiple text files with a single command  I want to remove the first line of multiple text files and replace it with another line  Is there a way to do this using the terminal I know how to use vim  is there a way to automate it with it  I want to avoid doing it manually  as in editing each file individually  If possible I d like to avoid installing new libraries  especially for something like that which i consider very simple   but I could be wrong  Thanks in advance  command-line text-processing
142	Is there a Paint NET alternative 	software-recommendation image-editor	Is there a Paint NET alternative  Does anyone know of a simple Image Editor  with functionality comparable to Paint NET   for Ubuntu   I ve always found GIMP to be overkill and too complicated for what I want to do  software-recommendation image-editor
688270	Mouse speed too fast	mouse xinput	Mouse speed too fast I ve a problem with the mouse speed    I have a gaming mouse with a hardware switch  1000 dpi  1600 dpi  2000 dpi  and I ve set it to 1000 dpi  I ve mouse acceleration and threshold set to 0  I tried solving with xset and xinput but it seemed to don t work at all  I don t know how to set mouse sensitivity under the min    Please help Running Ubuntu 15 04 x86 mouse  Redragon Centrophorus Thanks in advance I had a look to  manpages ubuntu com manpages vivid man4 mousedrv 4 html   I found this  click me  the second is what i ve already tried  and doesn t work  anyone know how to use the first option  mouse xinput
295059	 Continue button  grayed out in  installation type  screen during 13 04 installation	system-installation 13.04 live-usb	 Continue button  grayed out in  installation type  screen during 13 04 installation I m installing Ubuntu 13 04 onto my 32 bit Intel Core 2 Duo CPU  from a live usb  One of the screens says  Installation type   with the three options  Install Ubuntu alongside Windows Vista  or  Replace Windows Vista with Ubuntu  or  Something else   No matter which of those three options I highlight  the  Continue  button is always grayed out and un selectable   I can only select  Quit  or  Back     When I highlight the second option  the word  Continue  switches to  Install Now  on the button     but it is still grayed out and unselectable  Other than the fact that I cannot  continue   the installer offers no information about what s going wrong  Any ideas  Thanks in advance    I am also happy to hear advice about how exactly I can file a bug report about this   system-installation 13.04 live-usb
295060	 buntu setup for Granny	distro-recommendation	 buntu setup for Granny I m trying to setup a  buntu system for grandma  Her needs are a browser  a text processer  libreoffice will be fine   being able to watch youtube and not being able to get into too much trouble deleting or misplacing files that she really would rather keep Is there one of the ubuntu variants that makes it easy to set this up  edubuntu   Or should one stick with the stock ubuntu  since I have only really experience with that  and then remove all superfluous menus etc  distro-recommendation
